アクター群	アクター	役割	社内外	立場	主担当業務
介護会員	介護会員	訪問介護サービスを受ける人。要望に合わせたスケジュール調整を必要とする	社外	受益者
サービス提供	サービススタッフ	訪問介護を実施する人。柔軟な働き方でスケジュールを調整しスキルに応じた仕事を担当する	社内	提供者
サービス提供	新人サービススタッフ	新しく加入したサービススタッフで教育を受ける対象	社内	提供者
事業所管理	管理者	訪問介護の計画立案、スケジュール調整、実施記録管理、介護会員管理、スタッフ管理、介護費用管理を行う責任者	社内	受益者	介護会員登録フロー、介護会員情報更新フロー、訪問介護スケジュール作成フロー、訪問介護スケジュール調整フロー、訪問介護記録登録フロー、新人スタッフ教育フロー、介護費用計算フロー、介護費用請求フロー、介護費用回収フロー、サービススタッフ登録フロー、サービススタッフ情報更新フロー
事業所管理	統括管理者	複数の小規模訪問介護事業所を一元的に管理する統括責任者	社内	受益者	事業所一元管理フロー
サービス提供	教育担当スタッフ	新しいサービススタッフに対して必要な教育を実施する担当者	社内	提供者
