情報	属性	関連情報	説明
介護会員	名前、連絡先、住所、介護度、介護会員状況分類、介護施設分類、要望内容、契約開始日、契約終了日	訪問介護スケジュール、訪問介護実施記録、介護費用請求	介護サービスを受ける対象者を一意に識別し管理するために必要
サービススタッフ	名前、連絡先、スキル、働き方分類、勤務可能曜日、勤務可能時間帯、所属介護施設、教育状況、資格情報	訪問介護スケジュール、訪問介護実施記録、スタッフ教育履歴	介護サービスを提供する人員を一意に識別し、スキルや働き方を管理するために必要
訪問介護スケジュール	訪問日時、訪問時間、サービス内容、担当スタッフ、介護会員、介護施設、スケジュール状態、調整履歴	介護会員、サービススタッフ、介護施設、訪問介護実施記録	介護会員とサービススタッフをマッチングした訪問予定を一意に識別し管理するために必要
介護施設	施設名称、所在地、介護施設分類、管轄事業所、管理者、連絡先、開設日	訪問介護スケジュール、サービススタッフ、統括事業所	訪問介護事業を行う小規模事業所や一元管理する事業所を一意に識別し管理するために必要
訪問介護実施記録	実施日時、実施時間、実施内容、担当スタッフ、介護会員、サービス品質評価、特記事項、記録作成日時	介護会員、サービススタッフ、訪問介護スケジュール、介護費用請求	実際に行われた訪問介護の内容を一意に識別し記録管理するために必要
介護費用請求	請求番号、請求対象期間、請求金額、計算基準、請求日、入金予定日、入金確認日、請求状態、介護会員	介護会員、訪問介護実施記録	介護サービスに対する費用計算と請求情報を一意に識別し管理するために必要
スタッフ教育履歴	教育実施日、教育内容、教育担当者、教育対象スタッフ、教育時間、到達度評価、次回教育予定	サービススタッフ	新しいサービススタッフの教育実施状況を一意に識別し管理するために必要
統括事業所	事業所名称、所在地、統括管理者、管轄施設リスト、設立日	介護施設	複数の小規模事業所を一元管理する統括事業所を識別し管理するために必要
